<!ELEMENT biblioteca (libro+)>
<!ELEMENT libro (titulo, autor+, anio, genero)>
<!ELEMENT titulo (#PCDATA)>
<!ELEMENT autor (#PCDATA)>
<!ELEMENT anio (#PCDATA)>
<!ELEMENT genero (#PCDATA)>